{
  "schema_version": "1.0",
  "problem_id": "replace_with_unique_id",
  "answer_version": 1,
  "verification": {
    "status": "unverified",
    "verified_by": null,
    "verified_at": null,
    "notes": null
  },
  "socket_pin_answers": {},
  "required_connections": [],
  "expected_nets": [],
  "allowed_alternatives": [],
  "forbidden_connections": [],
  "wiring_connections": [],
  "wiring_forbidden_connections": [],
  "wire_color_rules": {
    "L1": "brown",
    "L2": "black",
    "L3": "gray",
    "control": "yellow"
  },
  "operation_tests": []
}
